Продукт,Старая Цена,Новая цена,Процент скидки,Время проведение акции
"Суп СЕМЕЙНЫЕ СЕКРЕТЫ, Грибной/Гороховый, 60г",23.00,16.99,−26%,с 13 апреля до 19 апреля
"Суп СЕМЕЙНЫЕ СЕКРЕТЫ, Грибной/Гороховый, 60г",23.00,16.99,−26%,с 13 апреля до 19 апреля
"Батончик ФИТНЕСС злаковый шоколад-банан, 23,5г",44.40,19.99,−55%,с 13 апреля до 19 апреля
"Пергамент АКАДЕМИЯ КОМФОРТА не силиконовый, 29смx8м",31.99,21.99,"−31,00%",с 07 апреля до 04 мая
"Вода питьевая BILLAGI® негазированная, 500мл",34.90,21.99,−37%,с 13 апреля до 19 апреля
"Напиток кисломолочный АКТИМЕЛЬ, Гранат, 100г",32.80,22.99,−30%,с 13 апреля до 19 апреля
"Напиток кисломолочный АКТИМЕЛЬ, Гранат, 100г",32.80,22.99,−30%,с 13 апреля до 19 апреля
"Актимель Клубника, 100г",32.80,22.99,−30%,с 13 апреля до 19 апреля
"Напиток кисломолочный АКТИМЕЛЬ Клубника, 100г",32.80,22.99,−30%,с 13 апреля до 19 апреля
"Печенье ЮБИЛЕЙНОЕ, витаминизированное традиционное, 112г",35.80,23.99,−33%,с 13 апреля до 19 апреля
"Печенье ЮБИЛЕЙНОЕ, Молочное, витаминное, 112г",35.80,23.99,−33%,с 13 апреля до 19 апреля
